{
  "id": "experiment-scar-tissue-cinematography-abc-a-v1",
  "parameters": {
    "fps": 45,
    "frame_end": 1260,
    "frame_start": 1,
    "shot_order": [
      "A1",
      "B",
      "C",
      "A2"
    ]
  },
  "proposal_id": "proposal-scar-tissue-cinematography-abc-a-v1",
  "runner": "cinematography.scar_tissue_handoff",
  "schema_version": 1,
  "state": "archived",
  "track": "cinematography",
  "visibility": "private"
}
